NVME Identify Controller:
vid       : 0x126f
ssvid     : 0x126f
sn        : S0000000
mn        : Demeter PF0
fr        : 3d61125 
rab       : 3
ieee      : 001b44
cmic      : 0x2
mdts      : 6
cntlid    : 0
ver       : 0x10400
rtd3r     : 0x186a0
rtd3e     : 0x7a120
oaes      : 0x300
ctratt    : 0x894
rrls      : 0
crdt1     : 0
crdt2     : 0
crdt3     : 0
oacs      : 0x9f
acl       : 3
aerl      : 7
frmw      : 0x12
lpa       : 0x1e
elpe      : 255
npss      : 4
avscc     : 0x1
apsta     : 0
wctemp    : 386
cctemp    : 395
mtfa      : 50
hmpre     : 16384
hmmin     : 16384
tnvmcap   : 512110190592
unvmcap   : 90112
rpmbs     : 0
edstt     : 15
dsto      : 1
fwug      : 0
kas       : 0
hctma     : 0x1
mntmt     : 233
mxtmt     : 398
sanicap   : 0x60000003
hmminds   : 0
hmmaxd    : 0
nsetidmax : 32
anatt     : 0
anacap    : 0
anagrpmax : 0
nanagrpid : 0
sqes      : 0x66
cqes      : 0x44
maxcmd    : 0
nn        : 32
oncs      : 0xdf
fuses     : 0
fna       : 0x6
vwc       : 0x7
awun      : 0
awupf     : 0
nvscc     : 1
nwpc      : 0
acwu      : 0
sgls      : 0
mnan      : 0
subnqn    : SUBNQNPF0
ioccsz    : 0
iorcsz    : 0
icdoff    : 0
ctrattr   : 0
msdbd     : 0
ps    0 : mp:7.00W operational enlat:100 exlat:100 rrt:0 rrl:0
          rwt:0 rwl:0 idle_power:1.0000W active_power:4.5000W
ps    1 : mp:5.00W operational enlat:100000 exlat:100000 rrt:1 rrl:1
          rwt:1 rwl:1 idle_power:- active_power:-
ps    2 : mp:4.50W operational enlat:100000 exlat:300000 rrt:2 rrl:2
          rwt:2 rwl:2 idle_power:- active_power:-
ps    3 : mp:0.0500W non-operational enlat:7000 exlat:10000 rrt:3 rrl:3
          rwt:3 rwl:3 idle_power:- active_power:-
ps    4 : mp:0.0040W non-operational enlat:7000 exlat:30000 rrt:4 rrl:4
          rwt:4 rwl:4 idle_power:- active_power:-
Node             SN                   Model                                    Namespace Usage                      Format           FW Rev  
---------------- -------------------- ---------------------------------------- --------- -------------------------- ---------------- --------
/dev/nvme0n1     S0000000             Demeter PF0                              1         512.11  GB / 512.11  GB    512   B +  0 B   3d61125 
